{
	"$schema": "http://json-schema.org/draft-07/schema#",
	"$id": "https://your-domain.example/schemas/project-manifest.schema.json",
	"title": "Portfolio Project Manifest",
	"description": "Contents of .portfolio/project.json in a project repository. The portfolio at your-domain.example fetches this file at build time and renders it as https://your-domain.example/projects/<slug>. Every field is optional; anything omitted falls back to the entry already in the portfolio's settings.json.",
	"type": "object",
	"additionalProperties": false,
	"properties": {
		"$schema": {
			"type": "string",
			"description": "Editor hint. Set to this schema URL for autocomplete."
		},
		"manifestVersion": {
			"type": "integer",
			"enum": [1, 2],
			"description": "Manifest format version. Use 2. Version 1 files keep working — 2 only adds fields (icon, readme, appearance, media.video, media.layout)."
		},
		"slug": {
			"type": "string",
			"pattern": "^[a-z0-9]+(-[a-z0-9]+)*$",
			"maxLength": 60,
			"description": "URL segment for the project page. Defaults to the repository name, lowercased. Changing this after the page is indexed loses its search ranking — pick once."
		},
		"name": { "type": "string", "maxLength": 80 },
		"tagline": {
			"type": "string",
			"maxLength": 120,
			"description": "One line under the title. Not a sentence — a label."
		},
		"summary": {
			"type": "string",
			"maxLength": 400,
			"description": "Two or three sentences. Used as the page meta description, so lead with what the project does, not with why it was built."
		},
		"status": {
			"type": "string",
			"enum": ["active", "maintained", "archived", "experimental", "complete"]
		},
		"category": { "type": "string", "maxLength": 60 },
		"tier": {
			"type": "string",
			"enum": ["featured", "secondary", "hidden"],
			"description": "Where the card sits on the Projects grid. Honoured in full for repos discovered outside settings.json; a settings.json entry that sets its own tier always wins. \"hidden\" opts the repo out of a generated page."
		},
		"order": {
			"type": "number",
			"description": "Position within the tier, lower first. Same precedence as tier."
		},
		"featured": {
			"type": "boolean",
			"description": "Marks the project featured. Same precedence as tier."
		},
		"listPrivate": {
			"type": "boolean",
			"description": "Private repos only: set true to publish a portfolio page built from this manifest and the repo README. Nothing else about the repo is exposed, and the page is labelled Private. Without it a private repo is never listed. Ignored on public repos."
		},
		"icon": {
			"type": "string",
			"pattern": "^[A-Z][A-Za-z0-9]{1,39}$",
			"description": "react-icons component name for the project, e.g. \"SiRust\", \"FaPython\", \"SiFastapi\". Used on the project card and page header. A name the icon set does not contain falls back to the language/technology guess, so it degrades rather than breaking."
		},
		"role": {
			"type": "string",
			"maxLength": 120,
			"description": "What you did on it, if the repo is not solo work."
		},
		"period": {
			"type": "object",
			"additionalProperties": false,
			"properties": {
				"start": { "type": "string", "description": "YYYY-MM or YYYY-MM-DD" },
				"end": {
					"type": ["string", "null"],
					"description": "YYYY-MM, YYYY-MM-DD, or null while ongoing"
				}
			}
		},
		"technologies": {
			"type": "array",
			"items": { "type": "string", "maxLength": 40 },
			"maxItems": 30
		},
		"tags": {
			"type": "array",
			"items": { "type": "string", "maxLength": 40 },
			"maxItems": 20
		},
		"highlights": {
			"type": "array",
			"maxItems": 10,
			"items": { "type": "string", "maxLength": 200 },
			"description": "Bullet points. Concrete outcomes beat adjectives."
		},
		"metrics": {
			"type": "array",
			"maxItems": 8,
			"description": "Numbers worth putting on a card. Both fields are required or the entry is dropped at build time.",
			"items": {
				"type": "object",
				"additionalProperties": false,
				"required": ["label", "value"],
				"properties": {
					"label": { "type": "string", "maxLength": 40 },
					"value": { "type": "string", "maxLength": 30 },
					"detail": { "type": "string", "maxLength": 120 }
				}
			}
		},
		"links": {
			"type": "object",
			"additionalProperties": false,
			"description": "Only http(s) URLs are rendered; anything else is dropped by the page.",
			"properties": {
				"repo": { "type": "string", "format": "uri" },
				"live": { "type": "string", "format": "uri" },
				"demo": { "type": "string", "format": "uri" },
				"docs": { "type": "string", "format": "uri" },
				"paper": { "type": "string", "format": "uri" },
				"package": { "type": "string", "format": "uri" }
			}
		},
		"media": {
			"type": "object",
			"additionalProperties": false,
			"properties": {
				"cover": {
					"type": "string",
					"format": "uri",
					"description": "Absolute URL. Relative repo paths do not resolve — the page is served from your-domain.example, not from the repo."
				},
				"screenshots": {
					"type": "array",
					"maxItems": 12,
					"description": "Shown as a carousel when there is more than one, unless media.layout says otherwise.",
					"items": {
						"type": "object",
						"additionalProperties": false,
						"required": ["url"],
						"properties": {
							"url": { "type": "string", "format": "uri" },
							"alt": { "type": "string", "maxLength": 160 },
							"caption": { "type": "string", "maxLength": 200 }
						}
					}
				},
				"layout": {
					"type": "string",
					"enum": ["auto", "carousel", "grid", "stack"],
					"description": "How screenshots are laid out. \"auto\" (the default) means a carousel for two or more, a single figure for one."
				},
				"video": {
					"type": "object",
					"additionalProperties": false,
					"required": ["url"],
					"description": "One demo video, shown above the screenshots. Only these hosts embed: youtube.com, youtu.be, vimeo.com. Any other https URL is treated as a direct video file and must end in .mp4, .webm or .ogg — anything else is dropped at build time.",
					"properties": {
						"url": { "type": "string", "format": "uri" },
						"title": { "type": "string", "maxLength": 120 },
						"poster": {
							"type": "string",
							"format": "uri",
							"description": "Absolute image URL. Only used for direct video files, not for embeds."
						},
						"caption": { "type": "string", "maxLength": 200 }
					}
				}
			}
		},
		"readme": {
			"description": "Render this repository's README (or another Markdown file) below the page body. `true` is shorthand for the object with its defaults.",
			"oneOf": [
				{ "type": "boolean" },
				{
					"type": "object",
					"additionalProperties": false,
					"properties": {
						"show": { "type": "boolean", "default": true },
						"path": {
							"type": "string",
							"maxLength": 200,
							"pattern": "^[^/][A-Za-z0-9._/-]*\\.(md|markdown|MD)$",
							"description": "Repo-relative path to the Markdown file. Defaults to README.md. Must stay inside the repo — no leading slash, no \"..\"."
						},
						"heading": { "type": "string", "maxLength": 80 },
						"collapsed": {
							"type": "boolean",
							"description": "Render it behind a \"Read more\" toggle instead of expanded. Default false."
						}
					}
				}
			]
		},
		"appearance": {
			"type": "object",
			"additionalProperties": false,
			"description": "Optional look of this one project page. Every key is a closed vocabulary, not CSS — omit the block entirely and the portfolio's own styling applies, which is the right default for almost every project.",
			"properties": {
				"theme": {
					"type": "string",
					"enum": [
						"default",
						"aurora",
						"ember",
						"ocean",
						"forest",
						"mono",
						"midnight"
					],
					"description": "Page background. \"default\" is the portfolio's black; the rest are gradients."
				},
				"background": {
					"type": "string",
					"enum": ["default", "plain", "grid", "dots", "glow"],
					"description": "Texture drawn over the gradient. \"default\" means whatever the portfolio uses."
				},
				"accent": {
					"type": "string",
					"pattern": "^#[0-9a-fA-F]{6}$",
					"description": "Six-digit hex, e.g. \"#dea584\". Tints the title rule, chips and links. Anything that is not exactly this shape is ignored."
				}
			}
		},
		"sections": {
			"type": "array",
			"maxItems": 20,
			"description": "The body of the page, in order. A section whose type is not in the enum is dropped at build time rather than rendered.",
			"items": {
				"type": "object",
				"additionalProperties": false,
				"required": ["type"],
				"properties": {
					"type": {
						"type": "string",
						"enum": ["prose", "list", "code", "table", "media"]
					},
					"heading": { "type": "string", "maxLength": 80 },
					"body": {
						"type": "string",
						"maxLength": 4000,
						"description": "prose: plain text paragraphs separated by a blank line (Markdown is not parsed). code: the snippet itself, rendered verbatim without syntax highlighting."
					},
					"items": {
						"type": "array",
						"maxItems": 30,
						"items": { "type": "string", "maxLength": 300 },
						"description": "list: bullet points."
					},
					"columns": {
						"type": "array",
						"maxItems": 6,
						"items": { "type": "string", "maxLength": 40 }
					},
					"rows": {
						"type": "array",
						"maxItems": 30,
						"items": {
							"type": "array",
							"items": { "type": "string", "maxLength": 160 }
						}
					},
					"url": {
						"type": "string",
						"format": "uri",
						"description": "media: absolute http(s) URL of one image. Anything else is dropped."
					},
					"alt": { "type": "string", "maxLength": 160 },
					"caption": { "type": "string", "maxLength": 200 }
				}
			}
		},
		"seo": {
			"type": "object",
			"additionalProperties": false,
			"description": "Overrides for the page head. Leave unset unless the summary makes a bad meta description.",
			"properties": {
				"title": { "type": "string", "maxLength": 70 },
				"description": { "type": "string", "maxLength": 160 },
				"image": {
					"type": "string",
					"format": "uri",
					"description": "Social card image. Overrides media.cover for og:image only."
				}
			}
		}
	}
}
